{
  "$schema": "https://json-schema.org/draft/2020-12/schema",
  "$id": "https://example.local/desktop-automation-mcp/schema/coordinate_profile.schema.json",
  "title": "Desktop Automation MCP coordinate profile",
  "description": "Versioned, verifiable coordinate map used by the server's resolve_coordinate_profile_point/check_coordinate_profile tools for canvas applications without UIA. NOTE: profile_id is a human-readable slug (not a UUID); rationale is in schema/README.md. NOTE: verification_points carry only expected_color ([r,g,b]) and stay inside the safe region selected by reference_region_name. NOTE: reference_image_hash is NOT THE IMAGE ITSELF but the SHA-256 digest of the policy-masked reference-region PNG; the image is never stored in the schema, example, or test (local privacy principle). NOTE: safe_regions names must be unique, rect/point fields must stay within window bounds, and created_at must not be in the future; these cross-field rules cannot be expressed in JSON Schema, so they are checked by src/desktop_automation_mcp/coordinate_profile.py.",
  "type": "object",
  "required": ["profile_id", "application", "window_size", "reference_region_name", "reference_image_hash", "safe_regions", "verification_points", "created_at"],
  "properties": {
    "profile_id": {
      "type": "string",
      "minLength": 1,
      "maxLength": 128,
      "pattern": "^[A-Za-z0-9][A-Za-z0-9._-]*$",
      "description": "Human-readable profile identity (e.g. ruffle-800x600-v1). Not a UUID: profiles are a small number of operator-managed files; readability in error messages, file names, and logs is preferred over opaque uniqueness."
    },
    "application": {
      "type": "object",
      "description": "Application the profile belongs to (one file = one application; consistent with the policy.schema.json model).",
      "required": ["process_path"],
      "additionalProperties": false,
      "properties": {
        "process_path": {
          "type": "string",
          "minLength": 1,
          "description": "Single full executable file path (consistent with the executable_path pattern in policy.schema.json: a SINGLE string, not a list)."
        },
        "app_version": {
          "type": "string",
          "minLength": 1,
          "description": "Optional application version. NOTE: not every application reports version information (e.g. unversioned nightly builds); this field is therefore NOT REQUIRED, but when given it cannot be empty. For an application with unknown version, the profile is guarded by the size+hash gates."
        }
      }
    },
    "window_size": {
      "type": "object",
      "description": "Window size at which the profile was recorded (pixels). A window of a different size does not match the profile.",
      "required": ["width", "height"],
      "additionalProperties": false,
      "properties": {
        "width": {
          "type": "integer",
          "minimum": 1,
          "description": "Window width, pixels, positive integer."
        },
        "height": {
          "type": "integer",
          "minimum": 1,
          "description": "Window height, pixels, positive integer."
        }
      }
    },
    "reference_region_name": {
      "type": "string",
      "minLength": 1,
      "description": "Name of the single safe_regions entry from which reference_image_hash was produced. The name must occur exactly once in safe_regions; verification_points must stay inside this region. This keeps profile verification from silently capturing the whole window."
    },
    "reference_image_hash": {
      "type": "string",
      "pattern": "^[0-9a-f]{64}$",
      "description": "SHA-256 digest of the allowed, policy-masked PNG region selected by reference_region_name (hashlib.hexdigest canonical form: 64 lowercase hex digits). NOTE: only lowercase is accepted; the uppercase variant is rejected to prevent normalization errors. The image itself is never stored."
    },
    "safe_regions": {
      "type": "array",
      "minItems": 1,
      "description": "Operator-preapproved safe click areas (window-relative). At least one region is required: a region-less profile cannot resolve any coordinate.",
      "items": {
        "type": "object",
        "required": ["name", "rect"],
        "additionalProperties": false,
        "properties": {
          "name": {
            "type": "string",
            "minLength": 1,
            "description": "Region name; must be UNIQUE within the profile (uniqueness is checked by the Python validator)."
          },
          "rect": {
            "type": "array",
            "minItems": 4,
            "maxItems": 4,
            "items": {
              "type": "integer",
              "minimum": 0
            },
            "description": "[left, top, right, bottom], window-relative pixels; negative values are therefore invalid. A negative screen/monitor origin is handled separately in the P2 matrix. left<right, top<bottom must hold and the rect must stay within window bounds (checked by the Python validator)."
          },
          "description": {
            "type": "string",
            "description": "Optional human-readable note (e.g. which UI element this region is)."
          }
        }
      }
    },
    "verification_points": {
      "type": "array",
      "minItems": 1,
      "description": "Profile validity canaries: whether these points still have the expected color in the live window verifies that the application was not updated / the theme did not change. At least one point is required.",
      "items": {
        "type": "object",
        "required": ["point", "expected_color"],
        "additionalProperties": false,
        "properties": {
          "point": {
            "type": "array",
            "minItems": 2,
            "maxItems": 2,
            "items": {
              "type": "integer",
              "minimum": 0
            },
            "description": "[x, y], window-relative pixels; negative values are therefore invalid and the point must stay within window bounds (checked by the Python validator)."
          },
          "expected_color": {
            "type": "array",
            "minItems": 3,
            "maxItems": 3,
            "items": {
              "type": "integer",
              "minimum": 0,
              "maximum": 255
            },
            "description": "[r, g, b], each channel 0-255. NOTE: exact match is required, there is NO tolerance (accepting near-colors would be a silent assumption about a different version/theme; a non-matching profile is rejected and the operator re-records it)."
          }
        }
      }
    },
    "created_at": {
      "type": "string",
      "pattern": "^\\d{4}-\\d{2}-\\d{2}[T ]\\d{2}:\\d{2}(:\\d{2}(\\.\\d+)?)?[+-]\\d{2}:?\\d{2}$",
      "description": "Moment the profile was recorded; ISO-8601 date-time with MANDATORY numeric UTC offset (same as the expires_at rule in policy.schema.json: bare 'Z'/offset-less not accepted). A past date is normal since a record is a retrospective observation; a FUTURE date is rejected (checked by the Python validator)."
    }
  },
  "additionalProperties": false
}
